album,track,lyrics
Wish You Were Here,Shine On You Crazy Diamond (Pts. 1-5),"Remember when you were young, You shone like the sun. Shine on you crazy diamond. Now there's a look in your eyes, Like black holes in the sky. Shine on you crazy diamond. You were caught on the crossfire Of childhood and stardom, Blown on the steel breeze. Come on you target for faraway laughter, Come on you stranger, you legend, you martyr, and shine! You reached for the secret too soon, You cried for the moon. Shine on you crazy diamond. Threatened by shadows at night, And exposed in the light. Shine on you crazy diamond. Well you wore out your welcome With random precision Rode on the steel breeze. Come on you raver, you seer of visions, Come on you painter, you piper, you prisoner, and shine!"
Wish You Were Here,Welcome to the Machine,"Welcome, my son, welcome to the machine.
Where have you been? It's alright, we know where you've been.
You've been in the pipeline, filling in time,
provided with toys and 'Scouting for Boys'.
You bought a guitar to punish your ma,
and you didn't like school, and you know you're nobody's fool,

so welcome to the machine.



Welcome, my son, welcome to the machine.

What did you dream? It's alright, we told you what to dream.

You dreamed of a big star, he played a mean guitar,

he always ate in the Steak Bar, he loved to drive in his Jaguar.

So welcome to the machine."
Wish You Were Here,Have a Cigar,"Come in here, dear boy, have a cigar. You're gonna go far,
you're gonna fly high, you're never gonna die, you're gonna make it if you try;
they're gonna love you.
Well I've always had a deep respect, and I mean that most sincerely.
The band is just fantastic, that is really what I think.
Oh by the way, which one's Pink?

And did we tell you the name of the game, boy,

we call it Riding the Gravy Train.



We're just knocked out, we heard about the sell out.

You gotta get an album out, you owe it to the people.

We're so happy we can hardly count.

Everybody else is just green, have you seen the chart?

It's a helluva start, it could be made into a monster

if we all pull together as a team.

And did we tell you the name of the game, boy,

we call it Riding the Gravy Train."
Wish You Were Here,Wish You Were Here,"So, so you think you can tell Heaven from Hell,
Blue skies from pain.
Can you tell a green field from a cold steel rail? 
A smile from a veil?
Do you think you can tell?

And did they get you trade your heroes for ghosts?

Hot ashes for trees? Hot air for a cool breeze?

Cold comfort for change? And did you exchange

A walk on part in the war for a lead role in a cage?



How I wish, how I wish you were here.

We're just two lost souls swimming in a fish bowl,

Year after year,

Running over the same old ground. What have we found?

The same old fears,

Wish you were here."
Wish You Were Here,Shine On You Crazy Diamond (Pts. 6-9),"Remember when you were young, You shone like the sun. Shine on you crazy diamond. Now there's a look in your eyes, Like black holes in the sky. Shine on you crazy diamond. You were caught on the crossfire Of childhood and stardom, Blown on the steel breeze. Come on you target for faraway laughter, Come on you stranger, you legend, you martyr, and shine! You reached for the secret too soon, You cried for the moon. Shine on you crazy diamond. Threatened by shadows at night, And exposed in the light. Shine on you crazy diamond. Well you wore out your welcome With random precision Rode on the steel breeze. Come on you raver, you seer of visions, Come on you painter, you piper, you prisoner, and shine!"
Animals,Dogs,"You gotta be crazy, you gotta have a real need.
You gotta sleep on your toes, and when you're on the street,
you gotta be able to pick out the easy meat with your eyes closed.
And then moving in silently, down wind and out of sight,
you gotta strike when the moment is right, without thinking.

And after a while you can work on points for style,

like the club tie and the firm handshake,

a certain look in the eye and an easy smile.

You have to be trusted by the people that you lie to,

so that when thy turn their backs on you,

you'll get the chance to put the knife in.



You gotta keep one eye looking over your shoulder.

You know it's going to get harder, and harder and harder as you get older.

And in the end you'll pack up and fly down south,

hide your head in the sand,

just another sad old man,

all alone and dying of cancer.



And when you loose control, you'll reap the harvest you have sown.

And as the fear grows, the bad blood slows and turns to stone.

And it's too late to loose the weight you used to need to throw around.

So have a good drown as you go down, alone,

dragged down by the stone.



I gotta admit that I'm a little bit confused.

Sometimes it seems to me as if I'm just being used.

Gotta stay awake, gotta try and shake off this creeping malaise.

If I don't stand my own ground, how can I find my own way out of this maze?



Deaf, dumb and blind, you just keep on pretending

that everyone's expendable and no-one has a real friend.

And it seems to you the thing to do would be to isolate the winner.

And everything's done under the sun,

and you believe a heart, everyone's a killer.



Who was born in a house full of pain,

who was trained not to spit in the fan,

who was told what to do by the man,

who was broken by trained personnel,

Who was fotted with collar and chain,

who was given a seat in the stand,

who was breaking away from the pack,

who was only a stranger at home,

who was ground down in the end,

who was found dead on the phone,

who was dragged down by the stone."
Animals,Pigs (Three Different Ones),"Big man, pig man, ha ha charade you are.
You well heeled big wheel, ha ha charade you are.
And when your hand is on your heart,
you're nearly a good laugh, almost a joker,
with your head down in the pig bin,
saying,  Keep on digging, pig stain on your fat chin.

What do you hope to find?

When you're down in the pig mine

You're nearly a laugh, you're nearly a laugh,

but you're really a cry.



Bus stop rat bag, ha ha charade you are.

You fucked up old hag, ha ha charade you are.

You radiate cold shafts of broken glass.

You're nearly a good laugh, 

almost worth a quick grin.

You like the feel of steel, 

you're hot stuff with a hat pin,

and good fun with a hand gun.

You're nearly a laugh, you're nearly a laugh,

but you're really a cry. 



Hey you, Whitehouse, 

ha ha charade you are.

You house proud town mouse, 

ha ha charade you are.

You're trying to keep our feelings off the street,

you're nearly a real treat, 

all tight lips and cold feet,

and do you feel abused?

You gotta stem the evil tide,

and keep it all on the inside.

Mary, you're nearly a treat, 

Mary, you're nearly a treat,

but you're really a cry."
Animals,Sheep,"Harmlessly passing your time in the grassland away,
only dimly aware of a certain unease in the air
You better watch out, there may be dogs about.
I've looked over Jordan, and I have seen things are not what they seem.
What do you get for pretending the dangers not real.

Meek and obedient you follow the leader

down well trodden corridors, into the valley of steel.

What a surprise! A look of terminal shock in your eyes.

Now things are really what they seem. No, this is no bad dream.



The Lord is my shepherd. I shall not want He makes me down to lie.

Through pastures green He leadeth me the silent waters by.

With bright knives He releaseth my soul.

He maketh me to hang on hooks in high places.

He converteth me to lamb cutlets.

For lo, He hath great power, and great hunger.

When cometh the day we lowly ones,

trough quiet reflection and great dedication,

master the art of karate,

lo, we shall rise up,

and then we'll make the buggers eyes water.



Bleating and babbling I fell on his neck with a sream.

Wave upon wave of demented avengers

march cheerfully out of obscurity unto the dream.



Have you heard the news? The dogs are dead!

You better stay home and do as you're told,

get out of the road if you want to grow old."
The Wall,In the Flesh?,"So ya
Thought ya
Might like to go to the show
To feel the warm thrill of confusion
That space cadet glow
Tell me is something eluding you sunshine?

Is this not what you expected to see?

If you'd like to find out what's behind these cold eyes?

You'll just have to claw your way through the

Disguise"
The Wall,The Thin Ice,"Momma loves her baby
And Daddy loves you too
And the sea may look warm to you Babe
And the sky may look blue
Ooooh Babe
Ooooh Baby Blue

Ooooh Babe

If you should go skating

On the thin ice of modern life

Dragging behind you the silent reproach

Of a million tear stained eyes

Don't be surprised, when a crack in the ice

Appears under your feet

You slip out of your depth and out of your mind

With your fear flowing out behind you

As you claw the thin ice"
The Wall,The Happiest Days of Our Lives,"When we grew up and went to school
There were certain teachers who would
Hurt the children any way they could
By pouring their derision
Upon anything we did
And exposing every weakness

However carefully hidden by the kids

But in the town it was well known

When they got home at night, their fat and

Psycopathic wives would thrash them

Within inches of their lives"
The Wall,"Another Brick in the Wall, Pt. 2","We don't need no education
We don't need no thought control
No dark sarcasm in the classroom
Teachers leave them kids alone
Hey!
Teacher, leave them kids alone!

All in all it's just another brick in the wall

All in all you're just another brick in the wall



We don't need no education

We don't need no thought control

No dark sarcasm in the classroom

Teachers leave them kids alone

Hey!

Teacher, leave us kids alone!

All in all you're just another brick in the wall

All in all you're just another brick in the wall



Wrong! Do it again!

If you don't eat your meat, you can't have any pudding!

How can you have any pudding if you don't eat your meat?

You! Yes! You behind the bike sheds! Stand still laddie!"
The Wall,Mother,"Mother, do you think they'll drop the bomb?
Mother, do you think they'll like this song?
Mother, do you think they'll try to break my balls?
Oohh..yeah, mother, should I build the wall?
Mother, should I run for President?

Mother, should I trust the government?

Mother, will they put me in the firing line?

Oohh..yeah, is it just a waste of time?



Hush now baby, baby, don't you cry

Momma's gonna make all of your nightmares come true

Momma's gonna put all of her fears into you

Momma's gonna keep you right here under her wing

She won't let you fly, but she might let you sing

Momma's gonna keep baby cozy and warm



Ooooh babe

Ooooh babe

Oooh babe, of course Momma's gonna help build the wall



Momma, do you think she's good enough

For me?

Momma, do you think she's dangerous

To me?

Momma, will she tear your little boy apart?

Oohh..yeah, mother, will she break my heart?



Hush now baby, baby, don't you cry

Momma's gonna check out all your girlfriends for you

Momma won't let anyone dirty get through

Momma's gonna wait up until you get in

Momma will always find out where you've been

Momma's gonna keep baby healthy and clean



Ooooh babe

Ooooh babe

Oooh babe, you'll always be baby to me



Mother, did it need to be so high?"
The Wall,Goodbye Blue Sky,"Oooooooo ooo ooo ooooh
Did you see the frightened ones
Did you hear the falling bombs
Did you ever wonder
Why we had to run for shelter
When the promise of a brave new world

Unfurled beneath a clear blue sky

Oooooooo ooo ooooo oooh

Did you see the frightened ones

Did you hear the falling bombs

The flames are all long gone

But the pain lingers on

Goodbye blue sky

Goodbye blue sky

Goodbye

Goodbye"
The Wall,Empty Spaces,"What shall we use to fill the empty
Spaces where we used to talk
How shall I fill the final places
How shall I complete the wall"
The Wall,Young Lust,"I am just a new boy
A stranger in this town
Where are all the good times
Who's gonna show this stranger around?
Ooooooooh I need a dirty woman
Ooooooooh I need a dirty girl

Will some woman in this desert land

Make me feel like a real man

Take this rock and roll refugee

Oooh Babe set me free

Ooooooooh I need a dirty woman

Ooooooooh I need a dirty girl.

Ooooooooh I need a dirty woman

Ooooooooh I need a dirty girl."
The Wall,One of My Turns,"Day after day, love turns grey
Like the skin of a dying man
Night after night, we pretend it's all right 
But I have grown older and
You have grown colder and
Nothing is very much fun any more.



And I can feel one of my turns coming on.

I feel cold as razor blade 

Tight as a tourniquet 

Dry as a funeral drum,

Run to the bedroom, in the suitcase on the left 

You'll find my favorite axe

Don't look so frightened

This is just a passing phase

Just one of my bad days

Would you like to watch T. V.?

Or get between the sheets?

Or contemplate the silent freeway?

Would you like something to eat?

Would you like to learn to fly?

Would you like to see me try?

Would you like call the cops?

Do you think it's time I stopped?

Why are you running away?"
The Wall,Don't Leave Me Now,"Oooh babe
Don't leave me now
Don't say it's the end of the road
Remember the flowers I sent
I need you, babe
To put through the shredder 

In front of my friends, oh babe

Don't leave me now

How could you go?

When you know how I need you (need you, need you...)

To beat to a pulp on a Saturday night

Oh babe

Don't leave me now

How can you treat me this way?

Running away (running away, running away...)

Oh babe

Why are you running away?"
The Wall,Goodbye Cruel World,"Goodbye cruel world
I'm leaving you today
Goodbye
Goodbye
Goodbye
Goodbye all you people

There's nothing you can say

To make me change

My mind

Goodbye."
The Wall,Hey You,"Hey you! Out there in the cold
setting lonely, getting old, can you feel me
Hey you! Standing in the aisles
with itchy feet and fading smiles, can you feel me
Hey you, don't help them to bury the light
Don't give in whitant a fight

Hey you! Out there on your own

Sitting naked by the phone would you touch me

Hey you! With your ear against the wall

Waiting for someone to call out would you touch me

Hey you! Would you help me to carry the stone

Open your heart, I'm coming home

But it was only fantasy

The wall was too high as you can see

No matter how he tried he could not break free

And the worms ate into his brain.

Hey you! Out there of the road

Doing what you're told, can you help me

Hey you! Out there beyond the wall

Breaking bottles in the hall, can you help me

Hey you! Don't tell me there's no hope at all

Together we stand, divided we fall"
The Wall,Is There Anybody Out There?,"Is there anybody out there?Is there anybody out there?Is there anybody out there?Is there anybody out there?"
The Wall,Nobody Home,"I've got a little black book with my poems in
I've got a bag with a toothbrush and a comb in
When I'm a good dog they sometimes throw me a bone in
I got elastic bands keeping my shoes on
Got those swollen hand blues.
Got thirteen channels of shit on the T.V. to choose from



I've got electric light

And I've got second sight

I've got amazing powers of observation



And that is how I know 

When I try to get through 

On the telephone to you 

There'll be nobody home 



I've got the obligatory Hendrix perm

And I've got the inevitable pinhole burns

All down the front of my favorite satin shirt 



I've got nicotine stains on my fingers

I've got a silver spoon on a chain

I've got a grand piano to prop up my mortal remains



I've got wild staring eyes

I've got a strong urge to fly 

But I've got nowhere to fly to



Ooooh Babe when I pick up the phone 

There's still nobody home

I've got a pair of Gohills boots

And I've got fading roots."
The Wall,Vera,"Does anybody here remember Vera Lynn
Remember how she said that
We would meet again
Some sunny day 
Vera! Vera!
What has become of you

Does anybody else in here

Feel the way I do ?"
The Wall,Bring the Boys Back Home,"Bring the boys back home
Bring the boys back home
Don't leave the children on their own
Bring the boys back home"
The Wall,Comfortably Numb,"Hello,
Is there anybody in there
Just nod if you can hear me
Is there anyone at home
Come on now 
I hear you're feeling down

Well, I can ease your pain

And get you on your feet again

Relax

I'll need some information first

Just the basic facts

Can you show me where it hurts?



There is no pain, you are receding

A distant ship smoke on the horizon

You are only coming through in waves

Your lips move but I can't hear what you're saying

When I was a child I had a fever

My hands felt just like two balloons

Now I've got that feeling once again

I can't explain, you would not understand

This is not how I am 

I have become comfortably numb



O.K. 

Just a little pin prick

There'll be no more aaaaaaaah! 

But you may feel a little sick

Can you stand up?

I do believe it's working, good

That'll keep you going through the show 

Come on it's time to go.



There is no pain you are receding 

A distant ship smoke on the horizon

You are only coming through in waves 

Your lips move but I can't hear what you're saying 

When I was a child 

I caught a fleeting glimpse

Out of the corner of my eye

I turned to look but it was gone

I cannot put my finger on it now

The child is grown

The dream is gone

And I have become

Comfortably numb."
The Wall,The Show Must Go On,"Oooh Ma Oooh Pa
Must the show go on
Oooh Pa take me home
Oooh Ma let me go
There must be some mistake
I didn't mean to let them

Take away my soul

Am I too old is it too late

Oooh Ma Oooh Pa

Where has the feeling gone?

Oooh Ma Oooh Pa

Will I remember the songs?

Oooooh aah th show must go on."
The Wall,In the Flesh,"So ya
Thought ya
Might like to go to the show
To feel the warm thrill of confusion
That space cadet glow
Tell me is something eluding you sunshine?

Is this not what you expected to see?

If you'd like to find out what's behind these cold eyes?

You'll just have to claw your way through the

Disguise"
The Wall,Run Like Hell,"You better run like hell
You better make your face up in
Your favourite disquise
With your button down lips and your
Roller blind eyes
With your empty smiler

And your hungry heart

Iced the bile rising from your quilty post

With your nerves in tatters

When the cockleshell shattens

And the hammers butter

Down the door

You better run like hell

You better run all day

And run all night

And keeps your dirty feelings

Deep inside

Take your girlfriend

Out tonight,

You better park the car

Well out of sight

Cos if they catch your in the back scat

Trying to pick her looks

They're gonna send you back to mother

In a cardboard box

You better run"
The Wall,Waiting for the Worms,"Ooooh you cannot reach me now 
Ooooh no matter how you try
Goodbye cruel world it's over
Walk on by
Sitting in a bunker here behind my wall

Waiting for the worms to come

In perfect isolation here behind my wall

Waiting for the worms to come



Waiting to cut out the deadwood 

Waiting to clean up the city

Waiting to follow the worms

Waiting to put on a black shirt

Waiting to weed out the weaklings 

Waiting to smash in their windows

And kick in their doors

Waiting for the final solution 

To strengthen the strain

Waiting to follow the worms

Waiting to turn on the showers v And fire the ovens 

Waiting for the queers and the coons

And the reds and the Jews

Waiting to follow the worms



Would you like to see Britannia

Rule again my friend

All you have to do is follow the worms



Would you like to send our coloured cousins

Home again my friend 

All you need to do is follow the worms."
The Wall,Stop,"Stop 
I wanna go home
Take off this uniform
And leave the show 
And I'm waiting here in this cell 
Because I have to know 

Have I been guilty all this time"
The Wall,The Trial,"Good morning Worm your honour 
The crowd will plainly show 
The prisoner who now stands before you
Was caught red handed showing feelings
Showing feelings of an almost human nature
This will not do



CALL THE SCHOOLMASTER



I always said he'd come to no good 

In the end your honour 

If they'd let me have my way I could 

Have flayed him into shape

But my hands were tied

The bleeding hearts and artists

Let him get away with murder 

Let me hammer him today



Crazy toys in the attic I am crazy

Truly gone fishing 

Crazy toys in the attic he is crazy 

They must have taken my marbles away

You little shit, you're in it now

I hope they throw away the key

You should've talked to me more often

Than you did, but no! You had to 

Go your own way! Have you broken any homes up lately?

Just five minutes, Worm your honour, him and me alone



Baaaaaabe 

Come to mother baby let me hold you in my arms

M'red I never wanted him to get in any trouble

Why'd he ever have to leave me 

Worm your honour let me take him home



Crazy, over the rainbow, I am crazy

Bars in the window

There must have been a door there in the wall

When I came in

Crazy, over the rainbow, he is crazy



The evidence before the Court is

Incontrovertible, there's no need for

The jury to retire

In all my years of judging

I have never heard before of

Someone more deserving

The full penalty of law



The way you made them suffer 

Your exquisite wife and mother

Fills me with the urge to defecate

Since, my friend, you have revealed your deepest fear 

I sentence you to be exposed before your peers:

Tear down the wall!"
The Wall,Outside the Wall,"All alone, or in twos
The ones who really love you
Walk up and down outside the wall
Some hand in hand 
Some gathering together in bands 

The bleeding hearts and the artists

Make their stand



And when they've given you their all

Some stagger and fall after all it's not easy

banging your heart against some mad buggers

Wall"
The Final Cut,The Post War Dream,"Tell me true tell me why was Jesus crucified
is it for this that daddy died?
was it for you? was it me?
did I watch too much t.v.?
Is that a hint of accusation in your eyes?
if it wasn't for the nips

being so good at building ships

the yards would still be open on the clyde

and it can't be much fun for them

beneath the rising sun

with all their kids committing suicide

what have we done maggie what have we done

what have we done to England

should we shout should we scream

""what happened to the post war dream?""

oh Maggie Maggie what have we done?"
The Final Cut,Your Possible Pasts,"They flutter behind you your possible pasts
some brighteyed and crazy some frightened and lost
a warning to anyone still in command
of their possible future to take care
in derelict sidings the poppies entwine
with cattle trucks lying in wait for the next time



Do you remember me? how we used to be?

do you think we should be closer?



She stood in the doorway the ghost of a smile

haunting her face like a cheap hotel sign

her cold eyes imploring the men in their macs

for the gold in their bags or the knives in their backs

stepping uo boldly one put out his hand

he said, "" I was just a child then now I'm only a man""



Do you remember me? how we used to be?

do you think we should be closer?



By the cold and religious we were taken in hand

shown how to feel good and told to feel bad

tongue tied and terrified we learned how to pray

now our feelings run deep and cold as the clay

and strung out behind us the banners and flags

of our possible pasts lie in tatters and rags



Do you remember me? how we used to be?

do you think we should be closer?"
The Final Cut,One of the Few,"When you're one of the few to land on your feet
what do you do to make ends meet?
teach
make them mad, make them sad, make them add two and two
make them me, make them you, make them do what you want them to
make them laugh, make them cry, make them lie down and die"
The Final Cut,When the Tigers Broke Free,"It was just before dawn one miserable morning
In black 'forty four
When the forward commander
Was told to sit tight
When he asked that his men be withdrawn
And the Generals gave thanks

As the other ranks held back

The enemy tanks for a while

And the Anzio bridge head

Was held for the price

Of a few hundred ordinary lives

And old King George sent Mother

A note when he heard that father was gone

It was, I recall, in the form of

A scroll, with gold leaf and all

And I found it one day

In a drawer of old photographs hidden away

And my eyes still grow damp to remember

His Majesty signed

With his own rubber stamp

It was dark all round, there was frost on the ground

When the tigers broke free

And no one survived 

From the Royal Fusiliers, company ""C"" They were all left behind

Most of them dead, the rest of them dying

And that's how the high command

Took my Daddy from me."
The Final Cut,The Hero's Return,"Jesus, Jesus what's it all about
trying to clout these little ingrates into shape
when I was their age all the lights went out
there was no time to whine and mope about
and even now part of me flies over

dresden at angels one five

though they'll never fathom it behind me

sarcasm desperate memories lie



Sweetheart sweetheart are you fast asleep, good

""cos that's the only time that I can really talk to you

and there is something that I've locked away

a memory that is too painful

to withstand the light of day



When we came back from the war the banners and

flags hung on everyones door

we danced and we sang in the street and

the church bells rang

but burning in my heart

my memory smoulders on

of the gunners dying words on the intercom"
