album,track,lyrics
The Piper at the Gates of Dawn,Astronomy Domine,"Lime and limpid green the second scene
the fights between the blue you once knew
floating down the sound resounds
around the icy waters underground
Jupiter and Saturn, Oberon there on the run
Titanian, Neptune, Titan, stars can frighten



Winding signs flap

flicker flicker flicker flam pow pow

stairways scared and death rules there

blindman limpid green the sound

surrounds the icy waters under

lime and limpid green the sound

surrounds the icy waters underground"
The Piper at the Gates of Dawn,Lucifer Sam,"Lucifer Sam saw your cat
always sitting by your side
always by you side
that cat's something I can't explain
Jennifer Gentle you're the witch
you're the left side, he's the right side

oh no

that cat's something I can't explain

Wouldn't say we're going to see

me a hip cat, me a ship's cat

somewhere, anywhere

that cat's something I can't explain"
The Piper at the Gates of Dawn,Matilda Mother,"There was a king who ruled the land
His Majesty was in command
with silver eyes the scarlet eagle
showered silver on the people
Oh mother tell me more
Why'd you have to leave me there

hanging in my infant chair

waiting

You only have to read the lines

they're scribbled in black and everything shines

Across the stream with wooden shoes

bells to tell the king the news

a thousand misty riders climb up

higher once upon a time

Wandering and dreaming

the words had different meanings

yes they did

For all the time spent in that view

the doll's house darkness' old perfume

and fairy-stories held me high

on clouds of sunlight floating by

Oh mother tell me more

tell me more"
The Piper at the Gates of Dawn,Flaming,"Alone in the clouds all blue
lying on an eiderdown
yippie, you can't see me
but I can you
Lazing in the foggy dew
sitting on a unicorn

no fear, you can't hear me

but I can you

Watching buttercups cuff the light

sleeping on a dandelion

too much, I won't touch you

but then I might

Screaming through the scarlet sky

travelling by telephone

hey, ho here we go

ever so high"
The Piper at the Gates of Dawn,Pow R. Toc H.,instrumental
The Piper at the Gates of Dawn,Take Up Thy Stethoscope and Walk,Doctor doctor!I'm in bedAchin' headGold is leadChoke on breadUnderfedGold is leadJesus bledPain is redAr egoonGrow goGreasy spoonYou swoonJune bloomMusic seems to help the painSeems to cultivate the brain.Doctor kindly tell your wife thatI'm alive - flowers thrive - realize - realizeRealize.
The Piper at the Gates of Dawn,Interstellar Overdrive,instrumental
The Piper at the Gates of Dawn,The Gnome,"I want to tell you a story
Bout' a little man
If I can
A gnome named Grimble Crumble
And little gnomes
Stay in their homes

Eating, sleeping, drinking their wine



He wore a scarlet tunic

A blue green hood

It looked quite good

He had a big adventure

Amidst the grass

Fresh air at last

Wining, dining, biding his time



And then one day

Hooray!

Another way for gnomes to say

Oooooooooomray



Look at the sky, look at the river

Isn't it good?

Look at the sky, look at the river

Isn't it good?



Winding, finding places to go.



And then one day - hooray!

Another way for gnomes to say

Hoooooooooray.

Hooooooooooooooray."
The Piper at the Gates of Dawn,Chapter 24,"A movement is accomplished in six stages
and the seventh brings return
the seven is the number of the young light
it forms when darkness isn't creased by one
Change returns succes
going and coming without error

action brings good fortune

sunset, sunrise

The time is with the month of winter solstice

when the change is due to gome

thunder in the early course of heaven

things cannot be destroyed once and all for all"
The Piper at the Gates of Dawn,The Scarecrow,"The black and green scarecrow as everyone knows
stood with a bird on his hat and swore
everywhere he didn't care
he stood in a field where barly grows
His head did no thinking, his arms didn't move
exept when the wind cut-a-pup and mice ran

around on the ground

he stood in a field where barley grows

The black and green scarecrow was sadder than me

but now he's resined to his fate 'cause life's not

unkind, he doesn't mind

he stood in a field where barley grows"
The Piper at the Gates of Dawn,Bike,"I've got a bike, you can ride if you like
it's got a basket, a bell that rings
and things to make it look good
I'd give it to you if I could
but I borrowed it
You're the kind of girl

that fits in with my world

I'll give you anything, everything

if you want thing

I've got a cloak, it's a bit of a joke

there's a tear up the front, it's red and black

I've had it for months

if you think it gould look good

then I guess it should

I know a mouse and he hasn't got a house

I don't know why I call him Gerald

He's getting rather old but he's a good mouse

I've got a clan of gingerbread men

here a man, there a man, lots of gingerbread men

take a couple if you wish, they're on the dish

I know a room of musical tune

some wine, some gin, most of them are clockwork

let's go into the other room and make them work"
A Saucerful of Secrets,Let There Be More Light,"Far far far away way
people heard him say say
I will find a way way
there will come a day day
something will be done

Then at last the mighty ship

descending at a point of flame

made contact with the human race at no time



Now now now is the time time

time to be be be aware



Not as far the solar bear

in human role revealed to him

a living soul of heavenward forever



Sunlight, something in my eye

something in the sky

waiting there for me



The antilope grows hurling back

the servicemen would like to sigh

the memory wentflowing rounds

as Lucy in the sky



Oh oh did you ever know

no never ever will they ascend



Summoning in his cosmic powers

and flowing slightly from his toes

psychedelic nations fly"
A Saucerful of Secrets,Remember a Day,"Remember a day before today
a day when you were young
renew a play along with time
evening with a thyme
Sing now a song that can't be sung

without a morning's kiss

dream you shall be it if you wish

look for your king

Why can't we play today

why can't we stay that way



Climb your fatal apple tree

try to catch the sun

hide from your little brother's gun

dream yourself away



Why can't we reach the sun

why can't we blow the years away

go away

remember remember"
A Saucerful of Secrets,Set the Controls for the Heart of the Sun,"Little by little the night turns around
counting the leaves wich tremble in the dawn
notices leaning on each other and yearning
under the leaves the swallow is resting
Set the controls for the heart of the sun



On to the mountain watching the Watcher

breaking the darkness, breaking the grapevine

the moment your flaw is run to your shadow

notice the shadow that reopens the vine

Set the controls for the heart of the sun

heart of the sun



Breaking the shape of his questions for ever

when the sun will fall in the evening

will he remember the lesson I gave him



Set the controls for the heart of the sun

heart of the sun"
A Saucerful of Secrets,Corporal Clegg,"Corporal Clegg had a wooden leg
He won it in the war
In 1944
Corporal Clegg had a medal too
In orange, red, and blue
He found it in the zoo

Dear oh dear oh were they really sad for me?

Dear oh dear oh will they really laugh at me?



Mrs. Clegg, you must be proud of him

Mrs. Clegg, another drop of gin?



Corporal Clegg umbrella in the rain

He's never been the same

No one is to blame

Corporal Clegg received his medal in a dream

From Her Majesty the Queen

His boots were very clean



Mrs. Clegg, you must be proud of him

Mrs. Clegg, another drop of gin?"
A Saucerful of Secrets,See-Saw,"""Marigolds are very much in love
but he doesn't mind
pickin' up sister
he makes his way in to the see-saw land
all the way up she smiles
she goes up while he goes down



Sits on a stick in the river

laughter in his sleep

sister's throwing stones

hoping for a hit

he doesn't know, so then

she goes up while he goes down

Another time, another day

a brother's way to leave

another time, another day day day



She was selling plastic flowers

on a sunday afternoon

pickin' up weeds, she hasn't got time to care

all can see, he's not there

she grows up for another man and he's down



another time, another day

a brother's way to leave

another time, another day 



(Thanks to ary for these corrections)"
A Saucerful of Secrets,Jugband Blues,"It's awfully considerate of you to think of me there
and I'm most obliged to you for making it clear
that I'm not there
and I never knew the room could be so big
and I never knew the room could be so blue
and I'm grateful that you threw away my old shoes

and brought me here instead dressed in red



And I'm wandering who could be writing this song

I don't care if the sun don't shine

I don't care if nothing is mine

and I don't care I'm nervous with you

I'll do my loving in the winter

And the sea isn't green

and I love the queen

and what exactly is a dream

and what exactly is a joke"
Atom Heart Mother,Atom Heart Mother,"""Here is a loud announcement""
""Silence in the studio!""
(Instrumental)"
Atom Heart Mother,If,"If I were a swan
I'd be gone
If I were a train
I'd be late
And if I were a good man
I'd talk with you more often than I do



If I were to sleep

I could dream

If I were afraid

I could hide

If I go insane

Please don't put your wires in my brain



If I were the moon

I'd be cool

If I were a rule

I would bend

If I were a good man

I'd understand the spaces between friends



If I were alone

I would cry

And if I were with you

I'd be home and dry

And if I go insane

Will you still let me join in with the game?



If I were a swan

I'd be gone

If I were a train

I'd be late again

If I were a good man

I'd talk with you more often than I do"
Atom Heart Mother,Summer '68,"Would you like to say something before you leave?
Perhaps you'd care to state exactly how you feel
We said goodbye before we said hello
I hardly even like you
I shouldn't care at all
We met just six hours ago

The music was too loud

From your bed I gained a day and lost a bloody year

And I would like to know

How do you feel?

How do you feel?



Not a single word we said

Delights still without fears

Occasinally you showed a smile

But what was the need

I felt the cold far too soon

The wind of '95

My friends are lying in the sun

I wish that I was there

Tomorrow brings another town

Another girl like you

Have you time before you leave to greet another man?

Just you let me know

How do you feel?

How do you feel?



Goodbye to you

Charlotte Kringles too

I've had enough for one day"
Atom Heart Mother,Fat Old Sun,"When that fat old sun in the sky is falling
Summer evenin' birds are calling
Summer's thunder time of year
The sound of music in my ears
Distant bells
New mown grass smells so sweet

By the river holding hands

Roll me up and lay me down



And if you see

Don't make a sound

Pick your feet up off the ground

And if you hear as the warm night falls

The silver sound from a time so strange

Sing to me

Sing to me



When that fat old sun in the sky is falling

Summer evenin' birds are calling

Children's laughter in my ears

The last sunlight disappears

And if you see

Don't make a sound

Pick your feet up off the ground

And if you hear as the warm night falls

The silver sound from a time so strange

Sing to me

Sing to me

When that fat old sun in the sky is...(fades out)"
Atom Heart Mother,Alan's Psychedelic Breakfast,(Instrumental)
Meddle,One of These Days,"One of these days
I'm going to cut you into little pieces"
Meddle,A Pillow of Winds,"The cloud of eiderdown draws around me
softening the sound
sleepy time when I lie with my love by my side
and she's breathing low, and the candle dies
When night comes down you lock the door

the book falls to the floor

as darkness falls and waves roll by

the seasons changed, the wind is warm



Now wakes the owl, now sleeps the swan

behold the dream, the dream is gone

green fields, a cold rain

is falling in a golden dawn



and deep beneath the ground the early morning sounds

and I go down

sleepy time when I lie with my love by my side

and she's breathing low and I rise like a bird

in the haze when the first rays touch the sky

and the night winds die"
Meddle,Fearless,"You say the hill's too steep to climb, try it
you say you'd like to see me try, climb it
you pick the place and I'll choose the time
and I'll climb the hill in my own way
just wait a while for the right day
and as I rise above the tree-line and the clouds

I look down, hearing the sounds of the things you've said today



Fearlessly the idiot faced the crowd, smiling

mercyless the magistrate turns round, frowning

and who's the fool who wears the crown

go down in your own way

and every day is the right day

and as you rise above the fear-lines in his crown

you look down, hearing the sound of the faces in the growd



You never walk alone, you never walk alone

walk on, walk on with hope in your heart

and you never walk alone, you never walk alone"
Meddle,San Tropez,"As I reach for a peach, slide a line down behind, a sofa in San Tropez
breaking a stick with a brick on the sand
riding a wave in the wake of an old sedan
sleeping alone in the drone of the darkness
scratched by the sand that fell from my love
keeping my dreams and I still hear her calling

if you're alone, I'll come home



Backward and homebound, a pigeon, a dove

gone with the wind, the rain on a airplane

owning a home with no silver spoon

I'm drinking champagne like a good tycoon

sooner than wiat for a break in the weather

I'll gather my far-glung thoughts together

speeding away on the wind to a new day

if you're alone, I'll come home



And I pause for a while by a country style

and listen to the things they say

digging the gold in a hole in my hand

hoping the good, take a look at the way things end

and you're leading me down to a place by the sea

I hear your soft voice calling to me

making a date for later by phone

And if you're alone, I'll come home



(Thanks to Marco for these corrections)"
Meddle,Seamus,"I was in the kitchen
Seamus, that's the dog, was outside
well I was in the kitchen
Seamus, my own hound, was outside
well you know the sun was sinking slowly
and my own hound-dog sat right down and cried"
Meddle,Echoes,"Overhead the albatross hangs motionless upon the air
And deep beneath the rolling waves
In labyrinths of coral caves
The echo of a distant tide
Comes willowing across the sand
And everything is green and submarine



And no-one showed us to the land

And no-one knows the where or whys

But something stirs and something tries

And starts to climb towards the light



Strangers passing in the street

By chance two separate glances meet

And I am you and what I see is me

And do I take you by the hand

And lead you through the land

And help me understand the best I can



And no-one calls us to move on

And no-one forces down our eyes

And no-one speaks and no-one tries

And no-one flies around the sun



Cloudless everyday you fall upon my waking eyes

Inviting and inciting me to rise

And through the window in the wall

Come streaming in on sunlight wings

A million bright ambassadors of morning



And no-one sings me lullabies

And no-one makes me close my eyes

And so I throw the windows wide

And call to you across the sky"
Obscured by Clouds,Burning Bridges,"Bridges burning glady, melting with the shadow
flickering between the lines
stolen mormons floating softly on the air
gone on wings of fire and climbing higher
Ancient bulbs are breaking, leaving all and changing sides

dreaming of a new day, cast aside the other way

magic vision, staring, kindled by the burning flames

lies in her eyes



The door it stands ajar

it was, it once was high beyond the guilded cage

beyond the reach of time, the moment is at hand

she breaks the golden band"
Obscured by Clouds,The Gold It's in the...,"Come on, my friends, let's make for the hills
they say there's gold and I'm looking for thrills
you can get your hands on whatever we find
' cause I've only come along for the ride
Well you go your way and I'll go mine

I don't care if we get there on time

everybody's searching for something, they say

I'll get my kicks on the way



Over the mountains, across the sea

who knows what may be waiting for me

I could sail forever to strange sounding names

faces of people and places don't change



All I have to do is just close my eyes

to see the seagulls wheeling in the far distants skies

all I wanna tell you, all I wanna say

is count me in on the journey, don't expect me to stay"
Obscured by Clouds,Mudmen,instrumental
Obscured by Clouds,Childhood's End,"You shout in your sleep
that's the price, it's just too steep
is your conscience at rest
it was put to the test
you awake with a start
just the beating of your heart

just one man beneath the sky

just two ears, just two eyes



You said, sail across the sea

long past thoughts and memories

childhood's end: your fantasies

merging harsh realities

and then as the sail is hoist

you'll find your eyes are growing moist

and all the fears never voiced

say you have to make the final choice



Who are you and who am I

to say we know the reason why

some are born, some men die

beneath one infinite sky

there'll be war and there'll be peace

but anything one day will cease

all the iron turn to rust

all the proud men turn to dust

so all things time will mend

so this song will end"
Obscured by Clouds,Free Four,"One two three four
The memories of a man in his old age
are the deeds of a man in his prime
you shuffle in the gloom of the sick room
and talk to yourself as you die



Life is a short warm moment

and death is a long cold rest

you get your change to try in the twinkling of an eye

eighty years with luck or even less



So all aboard for the American tour

and maybe you'll make it to the top

but mind how you go, and I can tell you ' cause I know

you may find it hard to get off



But you are the angel of death

and I am the dead man's son

he was buried like a mole in a fox-hole

and everyone's still on the run



And who is the master of foxhounds

and who says the hunt is begun

and who calls the tune in the court-room

and who beats the funeral drum"
Obscured by Clouds,Stay,"Stay and help me to end the day
and if you don't mind, we'll break a bottle of wine
stick around and maybe we'll get one down
' cause I want to find what lies behind those eyes
Midnight blue, burning gold

a yellow moon is growing cold

I rise, looking through my morning eyes

surprised to find you by my side

light my brain, don't try to remember your name

to find the words to tell you goodbye



Morning dews, newborn day

midnight blue turned to grey

midnight blue, burning gold

a yellow moon is growing cold"
Obscured by Clouds,Absolutely Curtains,Instrumentalstück
The Dark Side of the Moon,Speak to Me,"I've been mad for fucking years
Absolutely years, been over the edge for yonks
Been working me buns off for bands
I've always been mad, I know I've been mad
Like the most of us have
Very hard to explain why you're mad

Even if you're not mad"
The Dark Side of the Moon,Breathe (In the Air),"Breathe, breathe in the airdon't be afraid to careleave, but don't leave melook around, choose your own groundfor long you live and high you fly,smiles you'll give and tears you'll cryand all you touch and all you see,is all your life will ever beRun, rabbit run!Dig that hole,forget the sunand when at last the work is donedon't sit down it's time to dig another onefor long you live and high you flybut only if you ride the tideand balanced on the biggest waveyou race towards an early grave"
The Dark Side of the Moon,On the Run,"Baggage, your passports ready,
and follow the green line to customs and then to immigration
BA two-one-five to Rome, Prado, Naples
May I have your attention, please,
customs will be receiving passengers
for BA two-one-five to Rome, Prado, Naples

Live for today, gone tomorrow, that's me

Ha-ha-ha-a-a-a-a-a!"
The Dark Side of the Moon,Time,"Ticking away the moments that make up a dull day 
Fritter and waste the hours in an offhand way 
Kicking around on a piece of ground in your home town 
Waiting for someone or something to show you the way
Tired of lying in the sunshine staying home to watch the rain 

You are young and life is long and there is time to kill today 

And then one day you find ten years have got behind you 

No one told you when to run you missed the starting gun 



And you run and you run to catch up with the sun but it's sinking 

Racing around to come up behind you again 

The sun is the same in a relative way but you're older 

Shorter of breath and one day closer to death



Every year is getting shorter never seem to find the time 

Plans that either come to naught or half a page of scribbled lines

Hanging on in quiet desperation is the English way 

The time is gone the song is over thought I'd something more to say



Home home again

I like to be here when I can

And when I come home cold and tired

It's good to warm my bones beside the fire

Far away across the field

The tolling of the iron bell

Calls the faithfull to their knees

To hear the softly spoken magic spell"
The Dark Side of the Moon,The Great Gig in the Sky,"And I am not frightened of dying
Any time will do, I don't mind
Why should I be frightened of dying?
There's no reason for it, you've gotta go sometime
I never said I was frightened of dying



I never said I was afraid of dying"
The Dark Side of the Moon,Money,"Money, get away
Get a good job with more pay and you're OK
Money, it's a gas
Grab that cash with both hands and make a stash
New car, caviar, four star daydream
Think I'll buy me a football team



Money, get back

I'm all right Jack keep your hands off of my stack

Money, it's a hit

Don't give me that do goody good bullshit

I'm in the high-fidelity first class traveling set

And I think I need a Lear jet





Money, it's a crime

Share it fairly but don't take a slice of my pie

Money, so they say

Is the root of all evil today

But if you ask for a rise

It's no surprise that they're giving none away





[Interview excerpts]

- Yeah (chuckles) I was in the right!

- Yes, absolutely in the right!

- I certainly was in the right!

- Yeah, I was definitely in the right. That geezer was cruising for a bruising!

- Yeah!

- Why does anyone do anything?

- I don't know, I was really drunk at the time!

- I was just telling him it was in, he could get it in Number Two. He was asking why it wasn't coming up on freight eleven. After, I was yelling and screaming and telling him why it wasn't coming up on freight eleven. It came to a heavy blow, which sorted the matter out"
The Dark Side of the Moon,Us and Them,"Us and them 
And after all we're only ordinary men 
Me,and you 
God only knows it's not what we would choose to do 
Forward he cried from the rear 
And the front rank died 

And the general sat,and the lines on the map 

Moved from side to side 

Black and blue 

And who knows which is which and who is who 

Up and down 

And in the end it's only round and round and round 

Haven't you heard it's a battle of words 

The poster bearer cried 

Listen son,said the man with the gun

there's room for you inside 



Down and out 

It can't be helped but there's a lot of it about 

With,without

And who'll deny it's what the fighting's all about 

Out of the way, it's a busy day 

I've got things on my mind 

For wants of the price of a tea and a slice 

The old man died."
The Dark Side of the Moon,Any Colour You Like,(Instrumental)
The Dark Side of the Moon,Brain Damage,"The lunatic is on the grass
The lunatic is on the grass
remembering games and daisy chains and laughs
got to keep the loonies on the path
The lunatic is in the hall

the lunatics are in my hall

the paper holds their folded faces to the floor

and every day the paper boy brings more



And if the dam breaks open many years too soon

and if there is no room upon the hill

and if your head explodes with dark forbodings too

I'll see you on the dark side of the moon

The lunatic is in my head

The lunatic is in my head

you raise the blade, you make the change

you rearrange me ' till I'm sane

you lock the door

and throw away the key

there's someone in my head but it's not me



And if the cloud bursts, thunder in your ear

you shout and no one seems to hear

and if the band you're in starts playing different tunes

I'll see you on the dark side of the moon"
The Dark Side of the Moon,Eclipse,"All that you touch 
All that you see 
All that you taste 
All you feel 
All that you love 
All that you hate 

All you distrust 

All you save 

All that you give 

All that you deal 

All that you buy 

Beg, borrow or steal 

All you create 

All you destroy 

All that you do 

All that you say 

All that you eat 

Everyone you meet 

All that you slight 

Everyone you fight 

all that is now 

All that is gone

All that's to come 

And everything under the sun is in tune 

But the sun is eclipsed by the moon"
